<?xml version="1.0" encoding="utf-8"?>
<xs:schema id="NewDataSet" xmlns="" xmlns:xs="http://www.w3.org/2001/XMLSchema" xmlns:msdata="urn:schemas-microsoft-com:xml-msdata">
  <xs:element name="ui">
    <xs:complexType>
      <xs:sequence>
        <xs:element name="object" minOccurs="0" maxOccurs="unbounded">
          <xs:complexType>
            <xs:attribute name="type" type="xs:string" />
            <xs:attribute name="id" type="xs:string" />
            <xs:attribute name="value" type="xs:string" />
            <xs:attribute name="disabled" type="xs:string" />
            <xs:attribute name="onChange" type="xs:string" />
          </xs:complexType>
        </xs:element>
      </xs:sequence>
      <xs:attribute name="nodetreenls" type="xs:string" />
      <xs:attribute name="treelistnls" type="xs:string" />
      <xs:attribute name="modalnls" type="xs:string" />
    </xs:complexType>
  </xs:element>
  <xs:element name="NewDataSet" msdata:IsDataSet="true" msdata:UseCurrentLocale="true">
    <xs:complexType>
      <xs:choice minOccurs="0" maxOccurs="unbounded">
        <xs:element ref="ui" />
      </xs:choice>
    </xs:complexType>
  </xs:element>
</xs:schema>
